{
  "schema_version": "1.0.0",
  "library_id": "usb-rescue-technical-library",
  "technician_profile_id": "usb-rescue-technician",
  "knowledge_class": "reusable-technical-knowledge",
  "boundary": {
    "non_experiential": true,
    "not_identity": true,
    "no_dataquad": true,
    "no_t_witness": true,
    "no_relationship_history": true,
    "product_knowledge_only": true,
    "note": "Reusable rescue-media patterns may persist; lived experience and identity continuity do not."
  },
  "reference_sources": [
    {
      "source_id": "usb-rescue-totem-pack",
      "source_type": "totem-reference-pack",
      "category": "usb-rescue",
      "status": "planned",
      "description": "Passive Totem references for bootable rescue media, offline volume inspection, and backup-first repair patterns.",
      "totem_ids": [],
      "use_boundary": {
        "passive_reference_only": true,
        "authorization_power": false,
        "dispatch_power": false,
        "mutation_power": false,
        "execution_power": false
      }
    },
    {
      "source_id": "windows-environment-totem-pack",
      "source_type": "totem-reference-pack",
      "category": "windows-environment",
      "status": "planned",
      "description": "Passive Totem references for offline Windows installation structure and recovery boundaries.",
      "totem_ids": [],
      "use_boundary": {
        "passive_reference_only": true,
        "authorization_power": false,
        "dispatch_power": false,
        "mutation_power": false,
        "execution_power": false
      }
    }
  ],
  "promotion_policy": {
    "candidate_allowed": true,
    "verified_requires": ["observed-evidence", "repair-result", "verification-method", "applicability-limits", "rollback-or-reversal-note"],
    "append_only": true
  },
  "records": [
    {
      "record_id": "offline-bcd-export-candidate",
      "status": "candidate",
      "problem_signature": "Offline Windows volume with boot configuration inconsistency.",
      "observed_evidence": ["Target disk and offline Windows volume are explicitly identified before repair."],
      "solution_pattern": "Export existing boot configuration before any boot repair proposal.",
      "applicability_limits": ["WinPE-style rescue session", "Exact target disk must be identified"],
      "rollback_or_reversal": "Use the exported BCD copy and recorded volume identifiers to restore prior boot state.",
      "verification_method": "Re-read the boot configuration and confirm the expected Windows loader target.",
      "source": {
        "source_type": "technician-derived",
        "created_utc": "2026-09-15T00:00:00Z",
        "notes": "Seed candidate describing backup-first rescue knowledge."
      }
    }
  ]
}
